{
  "$schema": "http://json-schema.org/draft-07/schema#",
  "type": "object",
  "required": [
    "$schema",
    "technology-capabilities-version",
    "name",
    "description",
    "links"
  ],
  "properties": {
    "$schema": {
      "type": "string",
      "format": "uri"
    },
    "technology-capabilities-version": {
      "type": "string",
      "pattern": "^\\d+\\.\\d+$"
    },
    "name": {
      "type": "string"
    },
    "description": {
      "type": "string"
    },
    "links": {
      "type": "object",
      "additionalProperties": {
        "type": "object",
        "required": ["type", "category", "url"],
        "properties": {
          "type": {
            "type": "string"
          },
          "category": {
            "type": "string"
          },
          "url": {
            "type": "string",
            "format": "uri"
          }
        },
        "additionalProperties": false
      }
    }
  },
  "additionalProperties": false
}
