{
  "$schema": "https://raw.githubusercontent.com/AerynOS/os-info/refs/heads/main/schema/0.1/technology-capabilities.schema.json",
  "technology-capabilities-version": "1.0",
  "name": "boulder",
  "description": "Modern package build system",
  "links": {
    "documentation": {
      "type": "website",
      "category": "documentation",
      "url": "https://aerynos.dev"
    }
  }
}
